number,value,datetime_start,datetime_complete,duration,params_class_weight,params_criterion,params_max_depth,params_max_features,params_min_samples_leaf,params_min_samples_split,params_n_estimators,state
153,0.682967963290675,2025-01-08 21:26:42.583530,2025-01-08 21:32:27.425778,0 days 00:05:44.842248,balanced,entropy,417,,24,88,4810,COMPLETE
154,0.6823388561248244,2025-01-08 21:26:55.950595,2025-01-08 21:33:01.541224,0 days 00:06:05.590629,balanced,entropy,675,,23,92,5949,COMPLETE
155,0.6825459685665702,2025-01-08 21:27:02.148058,2025-01-08 21:32:42.951085,0 days 00:05:40.803027,balanced,entropy,680,,25,85,4807,COMPLETE
156,0.6827760021847359,2025-01-08 21:27:08.660003,2025-01-08 21:33:10.154977,0 days 00:06:01.494974,balanced,entropy,457,,22,91,5915,COMPLETE
157,0.6851792260966082,2025-01-08 21:27:23.329802,2025-01-08 21:32:59.920176,0 days 00:05:36.590374,balanced,entropy,678,,23,26,4769,COMPLETE
158,0.683870973565594,2025-01-08 21:27:28.669606,2025-01-08 21:33:04.303521,0 days 00:05:35.633915,balanced,entropy,667,,25,20,4869,COMPLETE
159,0.6843811392725258,2025-01-08 21:27:37.933513,2025-01-08 21:33:12.699371,0 days 00:05:34.765858,balanced,entropy,673,,25,19,4792,COMPLETE
160,0.6821327861427028,2025-01-08 21:27:43.334023,2025-01-08 21:33:25.236117,0 days 00:05:41.902094,balanced,entropy,447,,27,25,4762,COMPLETE
161,0.6840787432747238,2025-01-08 21:28:00.007290,2025-01-08 21:33:38.423881,0 days 00:05:38.416591,balanced,entropy,454,,25,20,4810,COMPLETE
162,0.6850927702110917,2025-01-08 21:29:05.970411,2025-01-08 21:33:53.571133,0 days 00:04:47.600722,balanced,entropy,451,,23,4,4563,COMPLETE
163,0.6823471255589094,2025-01-08 21:29:18.950264,2025-01-08 21:34:12.888436,0 days 00:04:53.938172,balanced,entropy,459,,29,25,4819,COMPLETE
164,0.6826376060461935,2025-01-08 21:29:20.653775,2025-01-08 21:34:25.679709,0 days 00:05:05.025934,balanced,entropy,437,,27,25,4851,COMPLETE
165,0.6823389035297098,2025-01-08 21:29:37.234839,2025-01-08 21:34:27.589281,0 days 00:04:50.354442,balanced,entropy,453,,29,5,4630,COMPLETE
166,0.6826804277255741,2025-01-08 21:29:41.182236,2025-01-08 21:34:32.467214,0 days 00:04:51.284978,balanced,entropy,422,,28,19,4698,COMPLETE
167,0.6827247393300526,2025-01-08 21:29:48.520903,2025-01-08 21:34:34.809841,0 days 00:04:46.288938,balanced,entropy,452,,29,17,4752,COMPLETE
168,0.6823426958766907,2025-01-08 21:29:50.223715,2025-01-08 21:34:42.958955,0 days 00:04:52.735240,balanced,entropy,435,,29,15,4737,COMPLETE
169,0.6817980074502712,2025-01-08 21:29:50.838710,2025-01-08 21:34:55.410108,0 days 00:05:04.571398,balanced,entropy,444,,30,20,4753,COMPLETE
170,0.6826594358954936,2025-01-08 21:30:25.057563,2025-01-08 21:35:07.699345,0 days 00:04:42.641782,balanced,entropy,430,,28,14,4826,COMPLETE
171,0.6820944476021723,2025-01-08 21:30:56.765681,2025-01-08 21:35:20.715599,0 days 00:04:23.949918,balanced,entropy,443,,29,20,4802,COMPLETE
172,0.6822120289106571,2025-01-08 21:31:03.952889,2025-01-08 21:35:42.020150,0 days 00:04:38.067261,balanced,entropy,437,,29,21,4825,COMPLETE
173,0.6816020954984338,2025-01-08 21:31:12.443707,2025-01-08 21:35:50.024320,0 days 00:04:37.580613,balanced,entropy,451,,31,23,4810,COMPLETE
174,0.6808908461647478,2025-01-08 21:31:18.434510,2025-01-08 21:35:51.500333,0 days 00:04:33.065823,balanced,entropy,421,,30,19,4439,COMPLETE
175,0.6831957190547512,2025-01-08 21:31:21.533789,2025-01-08 21:35:09.894784,0 days 00:03:48.360995,balanced,entropy,419,sqrt,31,18,5353,COMPLETE
176,0.700262007730185,2025-01-08 21:31:31.668267,2025-01-08 21:35:35.684820,0 days 00:04:04.016553,balanced,entropy,431,sqrt,5,3,5506,COMPLETE
177,0.6990434628056797,2025-01-08 21:31:31.960423,2025-01-08 21:35:32.227811,0 days 00:04:00.267388,balanced,entropy,450,sqrt,5,22,5295,COMPLETE
178,0.6773634803884184,2025-01-08 21:32:01.576927,2025-01-08 21:38:06.268062,0 days 00:06:04.691135,balanced,entropy,422,,1,5,5311,COMPLETE
179,0.6990775609472849,2025-01-08 21:32:07.952781,2025-01-08 21:35:52.207855,0 days 00:03:44.255074,balanced,entropy,459,sqrt,5,22,5332,COMPLETE
180,0.6932972204678216,2025-01-08 21:32:19.397475,2025-01-08 21:37:28.189335,0 days 00:05:08.791860,balanced,entropy,631,,5,20,5387,COMPLETE
181,0.6924623723443816,2025-01-08 21:32:27.427783,2025-01-08 21:37:36.259267,0 days 00:05:08.831484,balanced,entropy,628,,5,22,5315,COMPLETE
182,0.6971689283843171,2025-01-08 21:32:42.953089,2025-01-08 21:36:42.130438,0 days 00:03:59.177349,balanced,entropy,415,sqrt,1,6,4435,COMPLETE
183,0.7016899168195266,2025-01-08 21:32:59.922175,2025-01-08 21:36:24.057847,0 days 00:03:24.135672,balanced,entropy,630,sqrt,4,3,4471,COMPLETE
184,0.6965296095696103,2025-01-08 21:33:01.543225,2025-01-08 21:36:20.168231,0 days 00:03:18.625006,balanced,entropy,617,sqrt,7,4,4617,COMPLETE
185,0.6640794729666404,2025-01-08 21:33:04.305521,2025-01-08 21:38:20.212968,0 days 00:05:15.907447,balanced,entropy,440,,1,2,4533,COMPLETE
186,0.7007088469215565,2025-01-08 21:33:10.156977,2025-01-08 21:36:43.834433,0 days 00:03:33.677456,balanced,entropy,427,sqrt,4,24,5414,COMPLETE
187,0.7007956243180559,2025-01-08 21:33:12.701370,2025-01-08 21:36:39.409600,0 days 00:03:26.708230,balanced,entropy,420,sqrt,5,5,4371,COMPLETE
188,0.7051538703308945,2025-01-08 21:33:25.238116,2025-01-08 21:37:34.268995,0 days 00:04:09.030879,balanced,entropy,417,sqrt,2,6,5304,COMPLETE
189,0.7006971604877429,2025-01-08 21:33:38.426880,2025-01-08 21:37:22.353011,0 days 00:03:43.926131,balanced,entropy,393,sqrt,5,12,5416,COMPLETE
190,0.6981337671920937,2025-01-08 21:33:53.573133,2025-01-08 21:37:23.340838,0 days 00:03:29.767705,balanced,entropy,85,sqrt,6,13,4480,COMPLETE
191,0.6722871736097553,2025-01-08 21:34:12.890655,2025-01-08 21:37:59.449351,0 days 00:03:46.558696,balanced,entropy,624,sqrt,1,2,4503,COMPLETE
192,0.6889927007033197,2025-01-08 21:34:25.681709,2025-01-08 21:37:52.412396,0 days 00:03:26.730687,balanced,entropy,631,sqrt,1,4,4392,COMPLETE
193,0.651151031477101,2025-01-08 21:34:27.591340,2025-01-08 21:37:40.436096,0 days 00:03:12.844756,balanced,entropy,6,sqrt,2,340,5434,COMPLETE
194,0.6637392481471401,2025-01-08 21:34:32.469326,2025-01-08 21:39:43.146685,0 days 00:05:10.677359,balanced,entropy,485,,1,2,4109,COMPLETE
195,0.6850606676355183,2025-01-08 21:34:34.811841,2025-01-08 21:40:38.420846,0 days 00:06:03.609005,balanced,entropy,616,,2,4,5371,COMPLETE
196,0.7039692173672089,2025-01-08 21:34:42.961956,2025-01-08 21:38:27.531004,0 days 00:03:44.569048,balanced,entropy,631,sqrt,2,3,4253,COMPLETE
197,0.7016635536305035,2025-01-08 21:34:55.412170,2025-01-08 21:38:34.219790,0 days 00:03:38.807620,balanced,entropy,610,sqrt,4,10,5357,COMPLETE
198,0.7004460254815235,2025-01-08 21:35:07.701399,2025-01-08 21:38:42.001282,0 days 00:03:34.299883,balanced,entropy,623,sqrt,5,2,5380,COMPLETE
199,0.6833579883825589,2025-01-08 21:35:09.896784,2025-01-08 21:39:21.476507,0 days 00:04:11.579723,balanced,entropy,628,sqrt,1,3,5312,COMPLETE
200,0.6929318457657822,2025-01-08 21:35:20.717604,2025-01-08 21:40:51.216662,0 days 00:05:30.499058,balanced,entropy,620,,5,4,5420,COMPLETE
201,0.705026129651957,2025-01-08 21:35:32.229811,2025-01-08 21:39:19.084689,0 days 00:03:46.854878,balanced,entropy,613,sqrt,2,4,5355,COMPLETE
202,0.7024564671534602,2025-01-08 21:35:35.686820,2025-01-08 21:39:10.425527,0 days 00:03:34.738707,balanced,entropy,83,sqrt,4,4,4370,COMPLETE
203,0.7049750341635717,2025-01-08 21:35:42.021672,2025-01-08 21:39:20.528728,0 days 00:03:38.507056,balanced,entropy,479,sqrt,2,7,4179,COMPLETE
204,0.6892915500856486,2025-01-08 21:35:50.026328,2025-01-08 21:39:10.570528,0 days 00:03:20.544200,balanced,entropy,615,sqrt,1,306,5161,COMPLETE
205,0.6869099257336555,2025-01-08 21:35:51.503333,2025-01-08 21:39:19.883989,0 days 00:03:28.380656,balanced,entropy,626,sqrt,3,350,5155,COMPLETE
206,0.697042999678405,2025-01-08 21:35:52.210854,2025-01-08 21:39:48.058864,0 days 00:03:55.848010,balanced,entropy,623,sqrt,6,8,4116,COMPLETE
207,0.689733207341514,2025-01-08 21:36:20.170231,2025-01-08 21:40:11.786613,0 days 00:03:51.616382,balanced,entropy,395,sqrt,1,4,3962,COMPLETE
208,0.7021915821788117,2025-01-08 21:36:24.059846,2025-01-08 21:39:57.272896,0 days 00:03:33.213050,balanced,entropy,632,sqrt,4,2,3959,COMPLETE
209,0.6721139809588849,2025-01-08 21:36:39.412601,2025-01-08 21:40:33.230528,0 days 00:03:53.817927,balanced,entropy,622,sqrt,1,2,4313,COMPLETE
210,0.702632186419061,2025-01-08 21:36:42.132437,2025-01-08 21:40:05.943748,0 days 00:03:23.811311,balanced,entropy,619,sqrt,4,2,4020,COMPLETE
211,0.690376760332208,2025-01-08 21:36:43.836433,2025-01-08 21:40:25.944573,0 days 00:03:42.108140,balanced,entropy,485,sqrt,1,4,4151,COMPLETE
212,0.7039272479616444,2025-01-08 21:37:22.356010,2025-01-08 21:40:25.513573,0 days 00:03:03.157563,balanced,entropy,390,sqrt,3,3,4171,COMPLETE
213,0.6945386482091601,2025-01-08 21:37:23.342839,2025-01-08 21:40:39.966666,0 days 00:03:16.623827,balanced,entropy,83,sqrt,1,5,3919,COMPLETE
214,0.6877217408632544,2025-01-08 21:37:28.191335,2025-01-08 21:40:27.694842,0 days 00:02:59.503507,balanced,entropy,83,sqrt,2,341,4145,COMPLETE
215,0.6980032310688465,2025-01-08 21:37:34.270995,2025-01-08 21:40:59.083211,0 days 00:03:24.812216,balanced,entropy,399,sqrt,4,36,5441,COMPLETE
216,0.7002546576943866,2025-01-08 21:37:36.261266,2025-01-08 21:40:51.566661,0 days 00:03:15.305395,balanced,entropy,89,sqrt,3,36,4046,COMPLETE
217,0.7054277787548914,2025-01-08 21:37:40.438094,2025-01-08 21:41:11.710510,0 days 00:03:31.272416,balanced,entropy,387,sqrt,2,6,4286,COMPLETE
218,0.7064969762610248,2025-01-08 21:37:52.415396,2025-01-08 21:41:19.543245,0 days 00:03:27.127849,balanced,entropy,611,sqrt,2,6,4047,COMPLETE
219,0.6965090208654443,2025-01-08 21:37:59.451353,2025-01-08 21:41:07.628899,0 days 00:03:08.177546,balanced,entropy,86,sqrt,7,2,4232,COMPLETE
220,0.6956529973503885,2025-01-08 21:38:06.270062,2025-01-08 21:41:06.931398,0 days 00:03:00.661336,balanced,entropy,84,sqrt,7,35,3922,COMPLETE
221,0.6942558357030242,2025-01-08 21:38:20.215966,2025-01-08 21:41:15.181140,0 days 00:02:54.965174,balanced,entropy,398,sqrt,9,36,4187,COMPLETE
222,0.6947830531364957,2025-01-08 21:38:27.533003,2025-01-08 21:41:15.690953,0 days 00:02:48.157950,balanced,entropy,86,sqrt,9,36,4007,COMPLETE
223,0.6937306236039893,2025-01-08 21:38:34.221788,2025-01-08 21:41:23.459323,0 days 00:02:49.237535,balanced,entropy,484,sqrt,11,36,4143,COMPLETE
224,0.6952622496199631,2025-01-08 21:38:42.004283,2025-01-08 21:41:28.164324,0 days 00:02:46.160041,balanced,entropy,85,sqrt,9,36,4144,COMPLETE
225,0.6949695010435066,2025-01-08 21:39:10.428527,2025-01-08 21:41:34.647343,0 days 00:02:24.218816,balanced,entropy,69,sqrt,9,36,4058,COMPLETE
226,0.6950689068821073,2025-01-08 21:39:10.572526,2025-01-08 21:41:41.958544,0 days 00:02:31.386018,balanced,entropy,90,sqrt,9,32,4007,COMPLETE
227,0.6948713708957159,2025-01-08 21:39:19.087246,2025-01-08 21:41:42.845100,0 days 00:02:23.757854,balanced,entropy,95,sqrt,9,36,3935,COMPLETE
228,0.6941704783167016,2025-01-08 21:39:19.886573,2025-01-08 21:41:45.420694,0 days 00:02:25.534121,balanced,entropy,90,sqrt,10,35,3992,COMPLETE
229,0.6937379955797883,2025-01-08 21:39:20.530727,2025-01-08 21:41:47.709349,0 days 00:02:27.178622,balanced,entropy,69,sqrt,10,39,4018,COMPLETE
230,0.6941387163322412,2025-01-08 21:39:21.478506,2025-01-08 21:41:50.653995,0 days 00:02:29.175489,balanced,entropy,489,sqrt,9,34,3999,COMPLETE
231,0.6949916609472558,2025-01-08 21:39:43.149391,2025-01-08 21:41:52.066312,0 days 00:02:08.916921,balanced,entropy,93,sqrt,9,37,4052,COMPLETE
232,0.6946176692013997,2025-01-08 21:39:48.060865,2025-01-08 21:41:54.951884,0 days 00:02:06.891019,balanced,entropy,94,sqrt,9,35,3618,COMPLETE
233,0.6942156564007268,2025-01-08 21:39:57.274897,2025-01-08 21:41:59.806088,0 days 00:02:02.531191,balanced,entropy,589,sqrt,10,36,3555,COMPLETE
234,0.6941662749509145,2025-01-08 21:40:05.946748,2025-01-08 21:42:04.019085,0 days 00:01:58.072337,balanced,entropy,380,sqrt,10,36,4020,COMPLETE
235,0.6939501307828283,2025-01-08 21:40:11.788612,2025-01-08 21:42:11.441845,0 days 00:01:59.653233,balanced,entropy,600,sqrt,11,36,3643,COMPLETE
236,0.6933975470434829,2025-01-08 21:40:25.515573,2025-01-08 21:42:13.903767,0 days 00:01:48.388194,balanced,entropy,609,sqrt,11,38,3657,COMPLETE
237,0.6924571972524513,2025-01-08 21:40:25.946572,2025-01-08 21:42:16.924774,0 days 00:01:50.978202,balanced,entropy,386,sqrt,12,35,3784,COMPLETE
238,0.6946202981779503,2025-01-08 21:40:27.699841,2025-01-08 21:42:18.155975,0 days 00:01:50.456134,balanced,entropy,597,sqrt,10,36,3601,COMPLETE
239,0.693794504013226,2025-01-08 21:40:33.233528,2025-01-08 21:42:21.639161,0 days 00:01:48.405633,balanced,entropy,599,sqrt,11,34,3552,COMPLETE
240,0.6907682019113744,2025-01-08 21:40:38.422845,2025-01-08 21:42:21.641161,0 days 00:01:43.218316,balanced,entropy,600,sqrt,13,38,3565,COMPLETE
241,0.6922865599923931,2025-01-08 21:40:39.968665,2025-01-08 21:42:21.983163,0 days 00:01:42.014498,balanced,entropy,134,sqrt,12,33,3449,COMPLETE
242,0.6923581677669279,2025-01-08 21:40:51.219662,2025-01-08 21:42:29.473222,0 days 00:01:38.253560,balanced,entropy,130,sqrt,12,36,3340,COMPLETE
243,0.6921199999495259,2025-01-08 21:40:51.568663,2025-01-08 21:42:33.179026,0 days 00:01:41.610363,balanced,entropy,121,sqrt,13,36,3414,COMPLETE
244,0.6921842008008086,2025-01-08 21:40:59.085211,2025-01-08 21:42:39.198404,0 days 00:01:40.113193,balanced,entropy,381,sqrt,12,40,3537,COMPLETE
245,0.6929185952302763,2025-01-08 21:41:06.934397,2025-01-08 21:42:45.002281,0 days 00:01:38.067884,balanced,entropy,385,sqrt,11,34,3487,COMPLETE
246,0.6906609227228073,2025-01-08 21:41:07.630898,2025-01-08 21:42:47.315271,0 days 00:01:39.684373,balanced,entropy,376,sqrt,14,36,3561,COMPLETE
247,0.6916539931797718,2025-01-08 21:41:11.712508,2025-01-08 21:42:50.472570,0 days 00:01:38.760062,balanced,entropy,384,sqrt,13,36,3779,COMPLETE
248,0.690637636665718,2025-01-08 21:41:15.183138,2025-01-08 21:42:50.588570,0 days 00:01:35.405432,balanced,entropy,371,sqrt,14,40,3463,COMPLETE
249,0.6918563239400596,2025-01-08 21:41:15.692953,2025-01-08 21:42:51.338585,0 days 00:01:35.645632,balanced,entropy,373,sqrt,13,36,3438,COMPLETE
250,0.6921056980491858,2025-01-08 21:41:19.545246,2025-01-08 21:42:52.530583,0 days 00:01:32.985337,balanced,entropy,116,sqrt,13,36,3460,COMPLETE
251,0.6916896908765251,2025-01-08 21:41:23.461322,2025-01-08 21:42:54.838244,0 days 00:01:31.376922,balanced,entropy,390,sqrt,13,36,3462,COMPLETE
252,0.6781276482274676,2025-01-08 21:41:28.166325,2025-01-08 21:42:56.955742,0 days 00:01:28.789417,balanced,entropy,383,sqrt,14,517,3779,COMPLETE
253,0.6800910062430637,2025-01-08 21:41:34.649342,2025-01-08 21:43:16.158519,0 days 00:01:41.509177,balanced,entropy,379,sqrt,15,422,5760,COMPLETE
254,0.6807473464793672,2025-01-08 21:41:41.960544,2025-01-08 21:43:08.023363,0 days 00:01:26.062819,balanced,entropy,369,sqrt,13,424,3651,COMPLETE
255,0.6792265539977982,2025-01-08 21:41:42.847101,2025-01-08 21:43:22.370577,0 days 00:01:39.523476,balanced,entropy,372,sqrt,13,516,5624,COMPLETE
256,0.6910103736011445,2025-01-08 21:41:45.422695,2025-01-08 21:43:18.687321,0 days 00:01:33.264626,balanced,entropy,400,sqrt,14,35,3531,COMPLETE
257,0.6800231828132338,2025-01-08 21:41:47.711348,2025-01-08 21:43:13.034603,0 days 00:01:25.323255,balanced,entropy,380,sqrt,14,429,3446,COMPLETE
258,0.6792165910015204,2025-01-08 21:41:50.655995,2025-01-08 21:43:27.487011,0 days 00:01:36.831016,balanced,entropy,593,sqrt,15,433,5531,COMPLETE
259,0.6452181424966758,2025-01-08 21:41:52.069313,2025-01-08 21:43:11.796263,0 days 00:01:19.726950,balanced,entropy,399,sqrt,274,30,3579,COMPLETE
260,0.6754993990834338,2025-01-08 21:41:54.953884,2025-01-08 21:43:16.692238,0 days 00:01:21.738354,balanced,entropy,374,sqrt,14,647,3697,COMPLETE
261,0.6224126549353207,2025-01-08 21:41:59.808088,2025-01-08 21:43:12.909871,0 days 00:01:13.101783,balanced,entropy,370,sqrt,432,64,3696,COMPLETE
262,0.6425229109508743,2025-01-08 21:42:04.021085,2025-01-08 21:43:24.283026,0 days 00:01:20.261941,balanced,entropy,142,sqrt,294,65,3348,COMPLETE
263,0.6460970033811864,2025-01-08 21:42:11.446844,2025-01-08 21:43:40.538415,0 days 00:01:29.091571,balanced,entropy,388,sqrt,263,66,5600,COMPLETE
264,0.6787500811085042,2025-01-08 21:42:13.906767,2025-01-08 21:43:49.527352,0 days 00:01:35.620585,balanced,entropy,397,sqrt,15,494,5688,COMPLETE
265,0.6467710758999193,2025-01-08 21:42:16.926775,2025-01-08 21:43:43.350684,0 days 00:01:26.423909,balanced,entropy,194,sqrt,260,23,5590,COMPLETE
266,0.6791654286379485,2025-01-08 21:42:18.158976,2025-01-08 21:43:50.092867,0 days 00:01:31.933891,balanced,entropy,363,sqrt,15,444,5566,COMPLETE
267,0.689379423002369,2025-01-08 21:42:21.643162,2025-01-08 21:44:05.967438,0 days 00:01:44.324276,balanced,entropy,363,sqrt,16,3,5675,COMPLETE
268,0.6736574421757296,2025-01-08 21:42:21.654164,2025-01-08 21:43:49.386642,0 days 00:01:27.732478,balanced,entropy,406,sqrt,16,801,5602,COMPLETE
269,0.6328574264465864,2025-01-08 21:42:21.987162,2025-01-08 21:43:49.502352,0 days 00:01:27.515190,balanced,entropy,404,sqrt,360,66,5689,COMPLETE
270,0.6896803676747961,2025-01-08 21:42:29.475222,2025-01-08 21:43:59.115087,0 days 00:01:29.639865,balanced,entropy,405,sqrt,17,3,4343,COMPLETE
271,0.6457837191279798,2025-01-08 21:42:33.182024,2025-01-08 21:43:51.300967,0 days 00:01:18.118943,balanced,entropy,266,sqrt,264,646,4427,COMPLETE
272,0.6300891185512018,2025-01-08 21:42:39.200404,2025-01-08 21:44:01.934759,0 days 00:01:22.734355,balanced,entropy,401,sqrt,383,67,4366,COMPLETE
273,0.6296335816623074,2025-01-08 21:42:45.004256,2025-01-08 21:44:10.212017,0 days 00:01:25.207761,balanced,entropy,406,sqrt,389,5,5625,COMPLETE
274,0.6225697681042334,2025-01-08 21:42:47.317271,2025-01-08 21:44:15.154921,0 days 00:01:27.837650,balanced,entropy,173,sqrt,433,2,5746,COMPLETE
275,0.6337373282395471,2025-01-08 21:42:50.474570,2025-01-08 21:44:17.555225,0 days 00:01:27.080655,balanced,entropy,651,sqrt,351,2,5692,COMPLETE
276,0.6714027677678819,2025-01-08 21:42:50.594571,2025-01-08 21:45:56.104575,0 days 00:03:05.510004,balanced,entropy,401,sqrt,1,2,5661,COMPLETE
277,0.6572649527196212,2025-01-08 21:42:51.340585,2025-01-08 21:44:21.409212,0 days 00:01:30.068627,balanced,entropy,403,sqrt,187,434,5583,COMPLETE
278,0.6467282022710205,2025-01-08 21:42:52.535585,2025-01-08 21:44:20.757714,0 days 00:01:28.222129,balanced,entropy,642,sqrt,256,65,5674,COMPLETE
279,0.6315988645930036,2025-01-08 21:42:54.840241,2025-01-08 21:44:26.119873,0 days 00:01:31.279632,balanced,entropy,406,sqrt,368,3,5629,COMPLETE
280,0.7015203531950488,2025-01-08 21:42:56.957742,2025-01-08 21:44:56.012453,0 days 00:01:59.054711,balanced,entropy,213,sqrt,1,66,5661,COMPLETE
281,0.6205105280204142,2025-01-08 21:43:08.025364,2025-01-08 21:44:32.254722,0 days 00:01:24.229358,balanced,entropy,645,sqrt,480,2,5650,COMPLETE
282,0.6197470678599725,2025-01-08 21:43:11.798269,2025-01-08 21:44:37.187564,0 days 00:01:25.389295,balanced,entropy,409,sqrt,475,2,5661,COMPLETE
283,0.7047538378155042,2025-01-08 21:43:12.914546,2025-01-08 21:45:52.539818,0 days 00:02:39.625272,balanced,entropy,472,sqrt,2,3,5659,COMPLETE
284,0.7055666835762296,2025-01-08 21:43:13.037603,2025-01-08 21:45:57.028560,0 days 00:02:43.990957,balanced,entropy,255,sqrt,2,2,5653,COMPLETE
285,0.6556600903282592,2025-01-08 21:43:16.160517,2025-01-08 21:44:44.826340,0 days 00:01:28.665823,balanced,entropy,646,sqrt,186,599,4379,COMPLETE
286,0.6725681014842438,2025-01-08 21:43:16.697239,2025-01-08 21:46:10.955843,0 days 00:02:54.258604,balanced,entropy,162,sqrt,1,2,5596,COMPLETE
287,0.6721339928711577,2025-01-08 21:43:18.689322,2025-01-08 21:46:10.095126,0 days 00:02:51.405804,balanced,entropy,413,sqrt,1,2,5551,COMPLETE
288,0.6542953702338856,2025-01-08 21:43:22.372577,2025-01-08 21:44:55.770441,0 days 00:01:33.397864,balanced,entropy,641,sqrt,185,808,4373,COMPLETE
289,0.7033476882590864,2025-01-08 21:43:24.295066,2025-01-08 21:45:30.932695,0 days 00:02:06.637629,balanced,entropy,650,sqrt,3,2,4387,COMPLETE
290,0.6892357630630497,2025-01-08 21:43:27.489011,2025-01-08 21:46:02.186754,0 days 00:02:34.697743,balanced,entropy,639,sqrt,1,4,4377,COMPLETE
291,0.6328621228031013,2025-01-08 21:43:40.540418,2025-01-08 21:45:16.929544,0 days 00:01:36.389126,balanced,entropy,177,sqrt,355,2,4446,COMPLETE
292,0.6193581652702078,2025-01-08 21:43:43.355681,2025-01-08 21:45:18.338943,0 days 00:01:34.983262,balanced,entropy,246,sqrt,478,4,4424,COMPLETE
293,0.7048436263771284,2025-01-08 21:43:49.389643,2025-01-08 21:46:18.417524,0 days 00:02:29.027881,balanced,entropy,649,sqrt,2,2,4375,COMPLETE
294,0.7042430846574099,2025-01-08 21:43:49.509352,2025-01-08 21:46:17.039004,0 days 00:02:27.529652,balanced,entropy,649,sqrt,2,7,4298,COMPLETE
295,0.6784619054578586,2025-01-08 21:43:49.572353,2025-01-08 21:45:56.572714,0 days 00:02:07.000361,balanced,entropy,651,sqrt,1,617,4304,COMPLETE
296,0.6601450166001189,2025-01-08 21:43:50.094866,2025-01-08 21:46:13.037837,0 days 00:02:22.942971,balanced,entropy,646,sqrt,172,3,4457,COMPLETE
297,0.7047292458078328,2025-01-08 21:43:51.303968,2025-01-08 21:47:07.831599,0 days 00:03:16.527631,balanced,entropy,635,sqrt,2,4,5091,COMPLETE
298,0.7047636557354803,2025-01-08 21:43:59.117097,2025-01-08 21:47:10.705317,0 days 00:03:11.588220,balanced,entropy,471,sqrt,2,5,5130,COMPLETE
299,0.7049501380409327,2025-01-08 21:44:01.936760,2025-01-08 21:47:11.943658,0 days 00:03:10.006898,balanced,entropy,654,sqrt,2,2,5049,COMPLETE
300,0.7035948369985084,2025-01-08 21:44:05.970441,2025-01-08 21:46:59.154771,0 days 00:02:53.184330,balanced,entropy,473,sqrt,3,5,5146,COMPLETE
301,0.7064482746417252,2025-01-08 21:44:10.214015,2025-01-08 21:47:16.576627,0 days 00:03:06.362612,balanced,entropy,579,sqrt,1,14,5093,COMPLETE
