number,value,datetime_start,datetime_complete,duration,params_class_weight,params_criterion,params_max_depth,params_max_features,params_min_samples_leaf,params_min_samples_split,params_n_estimators,state
451,0.6639703455624654,2025-01-08 21:56:59.338780,2025-01-08 21:59:18.163234,0 days 00:02:18.824454,,entropy,427,log2,12,83,5825,COMPLETE
452,0.6896679058959384,2025-01-08 21:57:00.407515,2025-01-08 21:59:22.378070,0 days 00:02:21.970555,balanced,entropy,425,log2,13,85,5852,COMPLETE
453,0.6897862156221831,2025-01-08 21:57:01.649086,2025-01-08 21:59:24.569372,0 days 00:02:22.920286,balanced,entropy,429,log2,13,77,5775,COMPLETE
454,0.6685905058997981,2025-01-08 21:57:20.123024,2025-01-08 21:59:46.440983,0 days 00:02:26.317959,,entropy,709,log2,14,18,5816,COMPLETE
455,0.689968579332595,2025-01-08 21:57:27.351592,2025-01-08 21:59:49.424485,0 days 00:02:22.072893,balanced,entropy,544,sqrt,12,81,6140,COMPLETE
456,0.6632898377648558,2025-01-08 21:57:29.720478,2025-01-08 21:59:52.264796,0 days 00:02:22.544318,,entropy,708,sqrt,12,84,6079,COMPLETE
457,0.6706185772942209,2025-01-08 21:57:32.243369,2025-01-08 21:59:57.092053,0 days 00:02:24.848684,,entropy,546,sqrt,12,3,5739,COMPLETE
458,0.6152767253307606,2025-01-08 21:57:35.463003,2025-01-08 21:59:42.542261,0 days 00:02:07.079258,,entropy,543,log2,144,82,5767,COMPLETE
459,0.6900287275780744,2025-01-08 21:57:36.999938,2025-01-08 22:00:03.933786,0 days 00:02:26.933848,balanced,entropy,690,log2,12,79,6117,COMPLETE
460,0.6676181346278298,2025-01-08 21:57:38.595541,2025-01-08 22:00:05.797840,0 days 00:02:27.202299,,entropy,698,log2,15,2,5675,COMPLETE
461,0.6616295256332134,2025-01-08 21:57:51.424694,2025-01-08 22:00:05.017385,0 days 00:02:13.592691,,entropy,697,log2,13,108,5568,COMPLETE
462,0.663220068062618,2025-01-08 21:57:51.642022,2025-01-08 22:00:11.851642,0 days 00:02:20.209620,,entropy,690,log2,13,83,6145,COMPLETE
463,0.68999911118276,2025-01-08 21:58:05.304032,2025-01-08 22:00:33.274073,0 days 00:02:27.970041,balanced,entropy,630,log2,13,76,6210,COMPLETE
464,0.6898502668072611,2025-01-08 21:58:09.762918,2025-01-08 22:00:30.481833,0 days 00:02:20.718915,balanced,entropy,709,log2,13,79,5587,COMPLETE
465,0.6897380044829303,2025-01-08 21:58:17.982639,2025-01-08 22:00:34.638824,0 days 00:02:16.656185,balanced,entropy,711,log2,13,71,5558,COMPLETE
466,0.659048697335621,2025-01-08 21:58:18.188212,2025-01-08 22:00:34.859979,0 days 00:02:16.671767,,entropy,696,sqrt,24,79,5604,COMPLETE
467,0.6086409472057017,2025-01-08 21:58:19.905589,2025-01-08 22:00:23.599572,0 days 00:02:03.693983,,entropy,711,log2,157,75,4859,COMPLETE
468,0.6466518136460309,2025-01-08 21:58:23.601499,2025-01-08 22:00:44.052890,0 days 00:02:20.451391,,entropy,700,log2,23,297,6144,COMPLETE
469,0.686113073234873,2025-01-08 21:58:26.602884,2025-01-08 22:00:44.159706,0 days 00:02:17.556822,balanced,entropy,697,log2,24,68,5205,COMPLETE
470,0.6843004050953719,2025-01-08 21:58:33.709153,2025-01-08 22:00:53.956782,0 days 00:02:20.247629,balanced,entropy,694,sqrt,26,78,6253,COMPLETE
471,0.6851302507392475,2025-01-08 21:58:36.663141,2025-01-08 22:00:52.824286,0 days 00:02:16.161145,balanced,entropy,729,sqrt,23,81,5248,COMPLETE
472,0.6850803376636151,2025-01-08 21:58:44.872074,2025-01-08 22:01:06.630136,0 days 00:02:21.758062,balanced,entropy,624,sqrt,24,83,6062,COMPLETE
473,0.6842643743405287,2025-01-08 21:58:58.500410,2025-01-08 22:01:00.252429,0 days 00:02:01.752019,balanced,entropy,695,sqrt,25,84,4872,COMPLETE
474,0.6842062617005352,2025-01-08 21:59:00.605348,2025-01-08 22:01:12.054294,0 days 00:02:11.448946,balanced,entropy,693,sqrt,27,71,5220,COMPLETE
475,0.686028427128574,2025-01-08 21:59:05.751081,2025-01-08 22:01:12.973350,0 days 00:02:07.222269,balanced,gini,57,sqrt,23,75,5226,COMPLETE
476,0.6860220259607305,2025-01-08 21:59:08.292061,2025-01-08 22:01:12.085895,0 days 00:02:03.793834,balanced,entropy,698,sqrt,25,32,4881,COMPLETE
477,0.6854163375758656,2025-01-08 21:59:09.050638,2025-01-08 22:01:17.796252,0 days 00:02:08.745614,balanced,gini,694,sqrt,24,78,4864,COMPLETE
478,0.6844023126300214,2025-01-08 21:59:18.175327,2025-01-08 22:01:23.125046,0 days 00:02:04.949719,balanced,gini,625,sqrt,24,105,5210,COMPLETE
479,0.6860751604011677,2025-01-08 21:59:19.260091,2025-01-08 22:01:29.341807,0 days 00:02:10.081716,balanced,gini,194,sqrt,22,79,5198,COMPLETE
480,0.6773389786003322,2025-01-08 21:59:22.380076,2025-01-08 22:01:36.850176,0 days 00:02:14.470100,balanced,gini,733,sqrt,55,103,6194,COMPLETE
481,0.6629755601539867,2025-01-08 21:59:24.571378,2025-01-08 22:01:26.494026,0 days 00:02:01.922648,balanced,gini,703,sqrt,147,2,4866,COMPLETE
482,0.6851131571072555,2025-01-08 21:59:42.544266,2025-01-08 22:01:49.882027,0 days 00:02:07.337761,balanced,gini,722,sqrt,26,33,6213,COMPLETE
483,0.6551118061741769,2025-01-08 21:59:46.442729,2025-01-08 22:01:42.586432,0 days 00:01:56.143703,balanced,gini,62,sqrt,202,34,6283,COMPLETE
484,0.680135643848137,2025-01-08 21:59:49.428238,2025-01-08 22:01:51.304738,0 days 00:02:01.876500,balanced,gini,687,sqrt,26,312,6141,COMPLETE
485,0.6859538853655623,2025-01-08 21:59:52.266803,2025-01-08 22:01:52.932205,0 days 00:02:00.665402,balanced,entropy,698,sqrt,25,34,5198,COMPLETE
486,0.6862286559433537,2025-01-08 21:59:57.101828,2025-01-08 22:01:52.900291,0 days 00:01:55.798463,balanced,gini,684,sqrt,24,35,4846,COMPLETE
487,0.6853767379557466,2025-01-08 22:00:03.935792,2025-01-08 22:02:03.610299,0 days 00:01:59.674507,balanced,gini,688,sqrt,25,34,5225,COMPLETE
488,0.684134756536674,2025-01-08 22:00:05.019392,2025-01-08 22:02:02.600195,0 days 00:01:57.580803,balanced,gini,736,sqrt,29,34,5208,COMPLETE
489,0.6854187121075138,2025-01-08 22:00:05.799847,2025-01-08 22:02:06.472538,0 days 00:02:00.672691,balanced,gini,999,sqrt,26,35,5203,COMPLETE
490,0.6854116154861679,2025-01-08 22:00:11.853648,2025-01-08 22:02:14.832892,0 days 00:02:02.979244,balanced,gini,63,sqrt,25,35,4875,COMPLETE
491,0.6851013348062214,2025-01-08 22:00:23.603584,2025-01-08 22:02:21.378352,0 days 00:01:57.774768,balanced,gini,628,sqrt,26,32,5217,COMPLETE
492,0.6808171755904858,2025-01-08 22:00:30.483839,2025-01-08 22:02:23.116953,0 days 00:01:52.633114,balanced,gini,57,sqrt,26,291,5200,COMPLETE
493,0.6848374446003249,2025-01-08 22:00:33.276078,2025-01-08 22:02:28.127178,0 days 00:01:54.851100,balanced,gini,49,sqrt,27,30,5242,COMPLETE
494,0.680685101981863,2025-01-08 22:00:34.640830,2025-01-08 22:02:26.200422,0 days 00:01:51.559592,balanced,gini,619,sqrt,27,290,5175,COMPLETE
495,0.6866370809474759,2025-01-08 22:00:34.872016,2025-01-08 22:02:31.505323,0 days 00:01:56.633307,balanced,gini,612,sqrt,23,33,5209,COMPLETE
496,0.6872212448310986,2025-01-08 22:00:44.054897,2025-01-08 22:02:36.744350,0 days 00:01:52.689453,balanced,entropy,636,sqrt,23,31,5185,COMPLETE
497,0.6861285559863592,2025-01-08 22:00:44.183598,2025-01-08 22:02:38.107263,0 days 00:01:53.923665,balanced,entropy,46,sqrt,24,36,5228,COMPLETE
498,0.6853213068144295,2025-01-08 22:00:52.826292,2025-01-08 22:02:38.773667,0 days 00:01:45.947375,balanced,gini,252,sqrt,26,35,5193,COMPLETE
499,0.6799780625331588,2025-01-08 22:00:53.969413,2025-01-08 22:02:37.710453,0 days 00:01:43.741040,balanced,gini,457,sqrt,23,368,4860,COMPLETE
